Year,Incident Date,Incident Type,Track,Inv Location,Racing Type Description,Division,Weather Conditions,Horse,Trainer,Jockey Driver,Incident Description,Death or Injury
2010,11/25/10,STEWARDS/VETS LIST,Aqueduct Racetrack (NYRA),3/16 pole,Racing,Thoroughbred,48*  Cloudy,Go Go Shoot,TODD A. PLETCHER,JOHN R. VELAZQUEZ,Go Go Shoot-Tr. Todd Pletcher-ambulanced off-scrape & swelling of RF knee-time off-rider to hospital,Steward's List
2010,12/18/10,STEWARDS/VETS LIST,Aqueduct Racetrack (NYRA),After the Race,Racing,Thoroughbred,Cloudy 37*,Muy Guapo,RAMON M. HERNANDEZ,EURICO DA SILVA,Muy Guapo-Tr. Ramon M. Hernandez-pulled up-vanned off-lame-to farm for time off,Steward's List
2011,8/14/11,STEWARDS/VETS LIST,Saratoga Racecourse (NYRA),1st turn,Racing,Thoroughbred,78* Cloudy,Walkinonbroadway,FRANK MARTIN,RYAN A. CURATOLO, Walkinonbroadway-Tr. Frank Martin-ambulanced off-bobbled at start-eased up-no injury found-continued training,Steward's List
2011,5/13/11,STEWARDS/VETS LIST,Belmont Park (NYRA),After the finish,Racing,Thoroughbred,68* Cloudy,Eur in the Mood,FRANK MARTIN,JANICE L. BLAKE,Eur in the Mood-Tr. Frank Martin-ambulanced off-LF lameness-ok after race,Steward's List
2010,11/18/10,STEWARDS/VETS LIST,Finger Lakes Gaming & Racetrack,After Finish,Racing,Thoroughbred, ,MISS BECKY,PAUL J. SIMEONE,GUARIONEX RIVERA,Miss Becky-Tr. Paul J. Simeone-pulled up-ambulanced off-RF bowed tendon-must requalify,Steward's List
2011,6/15/11,STEWARDS/VETS LIST,Belmont Park (NYRA),After the finish,Racing,Thoroughbred,75* Clear,Able Bellamy,RICHARD L. STOKLOSA,DAVID COHEN,Able Bellamy-Tr. Richard Stoklosa-ambulanced off-lame RF quarter & foot,Steward's List
2011,5/21/11,STEWARDS/VETS LIST,Belmont Park (NYRA),After Finish,Racing,Thoroughbred,65* Cloudy,Moon Ala Mode,CARL J. DOMINO,ALAN GARCIA,Moon Ala Mode-Tr. Carl Domino-pulled up-vanned off-no injuries reported,Steward's List
2011,8/13/11,STEWARDS/VETS LIST,Saratoga Racecourse (NYRA),1/16 pole,Racing,Thoroughbred,83* Clear,Hot Pursuit,RONALD W. WERNER,DAVID COHEN,Hot Pursuit-Tr. Ronald Werner-pulled up-ambulanced off-no injuries found,Steward's List
2012,10/4/12,STEWARDS/VETS LIST,Finger Lakes Gaming & Racetrack,"Main Track, 1/4 Pole",Racing,Thoroughbred,Partly Cloudy 65 to 70 : degrees F,Brooke Haley,JOSE A. CABRERA,JOSE A. GUTIERREZ,Brooke Haley-Tr. Jose Cabrera-pulled up-bled-must requalify,Steward's List
2012,4/4/12,STEWARDS/VETS LIST,Aqueduct Racetrack (NYRA),"Aqueduct Turf, Post Parade",Racing,Thoroughbred,Clear 55 to 60 : degrees F,Raffie's Magic,JAMES T. RYERSON,OMAR HERNANDEZ,Raffie's Magic-Tr. James Ryerson-unseated rider and ran off-scratched-no injuries reported,Steward's List
2013,6/22/13,STEWARDS/VETS LIST,Belmont Park (NYRA),After finish,Racing,Thoroughbred,90* Clear,Wicked Disco,JAMES T. RYERSON, ,Wicked Disco-Tr. James Ryerson -pulled up-ambulanced off- Bled,Steward's List
2012,7/14/12,STEWARDS/VETS LIST,Belmont Park (NYRA),"Inner Turf, 1/2 mile pole",Racing,Thoroughbred,Partly Cloudy 80 to 85 : degrees F,Oh So Debonaire,JAMES T. RYERSON,JOE A. BRAVO,Oh So Debonaire-Tr. James Ryerson-pulled up-ambulanced off-no injury reported-must requalify,Steward's List
2012,12/28/12,STEWARDS/VETS LIST,Aqueduct Racetrack (NYRA),"Inner Track, Finish of Race",Racing,Thoroughbred,Clear 30 to 40 : degrees F,Fiftyfour Forever,ANTHONY T. QUARTAROLO JR,WILMER GARCIA,Fiftyfour Forever-Tr. Anthony Quartarolo-pulled up-fell-ambulanced off-no injuries reported, 
2011,10/24/11,STEWARDS/VETS LIST,Finger Lakes Gaming & Racetrack,1/4 pole,Racing,Thoroughbred, ,JUST A WHIM,EDWARD J. BABCOCK,EMANUEL DE DIEGO,Just A Whim-Tr. Edward Babcock-pulled up-vanned off-LF bowed tendon,Lameness
2011,12/16/11,STEWARDS/VETS LIST,Aqueduct Racetrack (NYRA),"Inner Track, 1/8 Pole",Racing,Thoroughbred,Sunny 40 to 45 : degrees F,Onafrozenrope,DOMINIC G. GALLUSCIO,JUNIOR R. ALVARADO,Onafrozenrope - Tr. Dominick Galluscio - ambulanced off - no injuries found,Steward's List
2012,3/9/12,STEWARDS/VETS LIST,Aqueduct Racetrack (NYRA),"Inner Track, 1/8 Pole",Racing,Thoroughbred,Cloudy 30 to 40 : degrees F,Gypsy Warrior,JEFFREY K. ODINTZ,JUNIOR R. ALVARADO,Gypsy Warrior-Tr. Jeffrey Odintz-pulled up-ambulanced off-no injuries reported-must requalify,Steward's List
2012,12/15/12,STEWARDS/VETS LIST,Aqueduct Racetrack (NYRA),"Inner Track, 1/2 mile pole",Racing,Thoroughbred,Clear 50 to 55 : degrees F,Brass Pear,JEFFREY K. ODINTZ,CORNELIO VELASQUEZ,Brass Pear-Tr. Jeffrey Odintz-pulled up-ambulanced off-sore shins-must requalify,Equine Injury
2012,6/29/12,STEWARDS/VETS LIST,Belmont Park (NYRA),"Inner Turf, Finish of Race",Racing,Thoroughbred,Hazy above 90 : degrees F,Shkspeare Shaliyah,DOODNAUTH SHIVMANGAL,RAJIV C. MARAGH,Shakespear Shaliyah-Tr. Doodnauth Shivmangal-pulled up-ambulanced off-heat exhaustion-rest recommended,Steward's List
2012,10/3/12,STEWARDS/VETS LIST,Belmont Park (NYRA),"Main Track, Finish of Race",Racing,Thoroughbred,Cloudy 70 to 75 : degrees F,Two Moons,PATRICK J. QUICK,KEIBER COA,Two Moons-Tr. Patrick Quick-pulled up-ambulanced off-strained LF suspensory-retired,Equine Injury
2013,5/5/13,STEWARDS/VETS LIST,Belmont Park (NYRA),Leaving gate,Racing,Thoroughbred, ,Scofield,PATRICK J. QUICK, ,Scofield - TOR Patrick Quick - pulled up - walked off - no injuries reported - must requalify,Steward's List
2012,11/14/12,STEWARDS/VETS LIST,Aqueduct Racetrack (NYRA),Aqueduct Turf,Racing,Thoroughbred,Partly Cloudy 45 to 50 : degrees F,Gulltopper,JAMES A. JERKENS,JUNIOR R. ALVARADO,Gulltopper-Tr. James Jerkens-eased up-walked off track-no injuries reported -must requalify,Equine Injury
2012,4/7/12,STEWARDS/VETS LIST,Aqueduct Racetrack (NYRA),"Main Track, 1/8 Pole",Racing,Thoroughbred,Clear 50 to 55 : degrees F,Casual Trick,NICHOLAS P. ZITO,COREY S. NAKATANI,Casual Trick-Tr. Nick Zito-pulled up-ambulanced off-horse choked-back in training,Steward's List
2013,2/15/13,STEWARDS/VETS LIST,Aqueduct Racetrack (NYRA),"Inner Track, 1/16 pole ",Racing,Thoroughbred,Clear 45 to 50 : degrees F,My Favorite Two,NICHOLAS P. ZITO,JUNIOR R. ALVARADO,My Favorite Two - Tr. Nick Zito - pulled up - ambulanced off-no injuries reported,Equine Injury
2012,3/11/12,STEWARDS/VETS LIST,Aqueduct Racetrack (NYRA),"Inner Track, 1/8 Pole",Racing,Thoroughbred,Sunny 45 to 50 : degrees F,Inner Compass,NICHOLAS P. ZITO,JUNIOR R. ALVARADO,Inner Compass-Tr. Nick Zito-pulled up-ambulanced off-old RF tendon issue-back in training-must requalify,Steward's List
2012,7/13/12,STEWARDS/VETS LIST,Belmont Park (NYRA),"Inner Turf, 3/8 Pole",Racing,Thoroughbred,Cloudy 80 to 85 : degrees F,Lane Drifter,NICHOLAS P. ZITO,ANNA (ROSIE) R. NAPRAVNIK,Lane Drifter-Tr. Nick Zito-pulled up-ambulanced off-did not like turf-worked to come off list-worked well,Steward's List
2012,4/15/12,STEWARDS/VETS LIST,Aqueduct Racetrack (NYRA),"Turf, 1/4 Pole",Racing,Thoroughbred,Cloudy 60 to 65 : degrees F,Lins Back,NEAL J. TERRACCIANO,MAYLAN L. STUDART,Lins Back-Tr. Neal Terracciano-pulled up-ambulanced off-no injury reported,Steward's List
2012,11/21/12,STEWARDS/VETS LIST,Aqueduct Racetrack (NYRA),"Main Track, 1/8 Pole",Racing,Thoroughbred,Clear 45 to 50 : degrees F,Never Content,JOSEPH G. PARKER,GARY G. RICHARDS,Never Content-Tr. Joseph Parker-pulled up-ambulanced off-no injury found-must requalify,Steward's List
2012,7/1/12,STEWARDS/VETS LIST,Belmont Park (NYRA),1/2 mile pole,Racing,Thoroughbred,Clear 85 to 90 : degrees F,My Leonora,JOSEPH E. DEMOLA,TOMESH(KUMAR) SINGH,My Leonora - Tr. Joseph Demola - stumbled unseating rider - ambulanced off - hit itself on front ankles causing cuts -resting while healing - must requalify,Steward's List
2013,6/15/13,STEWARDS/VETS LIST,Belmont Park (NYRA),Start,Racing,Thoroughbred,80* Clear,Impetuous Spirit,JOHN C. KIMMEL, ,Impetuous Spirit-Tr. John Kimmel -ducks inside leaving gate-pulled up-no injuries reported, 
2012,11/23/12,STEWARDS/VETS LIST,Aqueduct Racetrack (NYRA),"Main Track, Finish of Race",Racing,Thoroughbred,Clear 45 to 50 : degrees F,Sense of Peace,JOHN C. KIMMEL,RAJIV C. MARAGH,Sense of Peace-Tr. John Kimmel-felt off-pulled up-ambulanced off-old ankle issue-must requalify,Steward's List
2013,1/17/13,STEWARDS/VETS LIST,Aqueduct Racetrack (NYRA),"Inner Track, After Finish",Racing,Thoroughbred,Mostly Cloudy 30 to 40 : degrees F,Volition,JOHN C. KIMMEL,JUNIOR R. ALVARADO,Volition-Tr. John Kimmel-pulled up-horse sustained a carpal sheath injury R knee- horse to be retired.  See Case R0035.13,Equine Injury
2012,12/30/12,STEWARDS/VETS LIST,Aqueduct Racetrack (NYRA),Starting Gate,Racing,Thoroughbred,Clear,Gendarmour,JOHN C. KIMMEL,JUNIOR R. ALVARADO,Gendarmour-Tr. John Kimmel-flipped in starting gate sustaining minor scratches on hock-scratched by NYRA Vet,Steward's List
2012,3/18/12,STEWARDS/VETS LIST,Aqueduct Racetrack (NYRA),"Inner Track, Finish of Race",Racing,Thoroughbred,Clear 50 to 55 : degrees F,Honorable Truth,DIANE C. BALSAMO,CHARLES C. LOPEZ,Honorable Truth-Tr. Diane Balsamo-pulled up-ambulanced off-sore feet-frog sloughed-to be rested,Steward's List
2013,5/3/13,STEWARDS/VETS LIST,Finger Lakes Gaming & Racetrack,Start,Racing,Thoroughbred,clear,Dancin On The Sand,RALPH D'ALESSANDRO,RODOLFO IGNACIO,Dancin On The Sand-Tr. Ralph D'Alessandro-turned & struck head breaking from gate and started acting up-rider jumped off-horse ran back to barn-no injuries reported,Steward's List
2012,4/22/12,STEWARDS/VETS LIST,Aqueduct Racetrack (NYRA),Starting gate,Racing,Thoroughbred,Rain 45 to 50 : degrees F,Grunge Girl,PAULINO O. ORTIZ,JOSE L. ESPINOZA,Notinrwildestremz-Tr. W. Turner-acted up in gate & kicked Grunge Girl-Tr. P. Ortiz-both horses scratched & walked off track-no injuries reported,Steward's List
2012,10/7/12,STEWARDS/VETS LIST,Belmont Park (NYRA),"Main Track, 3/16 pole",Racing,Thoroughbred,Cloudy 55 to 60 : degrees F,Brassy Ego,SCOTT M. SCHWARTZ,JUNIOR R. ALVARADO,Brassy Ego-Tr. Scott Schwartz-pulled up-ambulanced off-no injuries reported-must requalify,Equine Injury
2012,9/19/12,STEWARDS/VETS LIST,Belmont Park (NYRA),"Main Track, 1/4 Pole",Racing,Thoroughbred,Clear 65 to 70 : degrees F,Rachini,CAROL A. D'ALOIA,MAYLAN L. STUDART,Rachini-Tr. Carol D'Aloia-pulled up-ambulanced off-took bad step-horse uninjured-must requalify,Steward's List
2013,3/20/13,STEWARDS/VETS LIST,Aqueduct Racetrack (NYRA),1/8 pole Aqueduct,Racing,Thoroughbred,Cold & Sunny,Warrior Marie,KENNETH G. STREICHER,JACQUELINE A. DAVIS,Warrior Marie-Tr. Ken Streicher-pulled up-cross cantered-DNF-vanned off-cuts RR leg,Steward's List
2013,2/2/13,STEWARDS/VETS LIST,Aqueduct Racetrack (NYRA),"Inner Track, Paddock",Racing,Thoroughbred,Cloudy 20 to 30 : degrees F,Two Blue,WILLIAM YOUNGHANS,JULISSA LAREDO,Two Blue-Tr. William Younghans-not acting right after race-ambulanced from paddock-vet checked-no injuries found-back training,Equine Injury
2012,3/17/12,STEWARDS/VETS LIST,Aqueduct Racetrack (NYRA),"Inner Track, 1/8 Pole",Racing,Thoroughbred,Clear 50 to 55 : degrees F,Purplegreenandgold,ROY S. LERMAN,ALAN GARCIA,Purplegreenandgold-Tr. Roy Lerman-pulled up-ambulanced off-no problems found-back in training,Steward's List
2013,5/10/13,STEWARDS/VETS LIST,Belmont Park (NYRA), ,Racing,Thoroughbred, ,Olympian,HAROLD (JAMES) J. BOND,JOSE LEZCANO,Olympian - TOR H. James Bond - Pulled up & vanned off - possibly choked down,Steward's List
2012,11/25/12,STEWARDS/VETS LIST,Aqueduct Racetrack (NYRA),"Main Track, Finish of Race",Racing,Thoroughbred,Partly Cloudy 30 to 40 : degrees F,Media Starlett,THOMAS ALBERTRANI,EDGAR S. PRADO,Media Starlett-Tr. Tom Albertrani-pulled up-ambulanced off-strained LF tendon-claim voided-must requalify,Steward's List
2012,4/5/12,STEWARDS/VETS LIST,Aqueduct Racetrack (NYRA),"Aqueduct Turf, Starting Gate",Racing,Thoroughbred,Clear 60 to 65 : degrees F,Ecru Egret,NEVILLE G. HENRY,ABEL LEZCANO,Ecru Egret-Tr. Neville Henry-scratched at Gate-walked off track-horse ok-trained next day,Steward's List
2012,11/24/12,STEWARDS/VETS LIST,Aqueduct Racetrack (NYRA),"Main Track, 1/16 pole",Racing,Thoroughbred,Clear 45 to 50 : degrees F,Market Blaster,WILLIAM BADGETT JR,JOSE LEZCANO,Market Blaster-Tr. William Badgett-eased in deep stretch-walked off-no injury reported-must requalify,Steward's List
2013,1/6/13,STEWARDS/VETS LIST,Aqueduct Racetrack (NYRA),Inner Track,Racing,Thoroughbred,Clear 20 to 30 : degrees F,Monterey Drive,GARY P. GULLO,ARIEL E. SMITH,Monterey Drive-Tr. Gary Gullo-never raced in contention and was distanced, 
2012,2/19/12,STEWARDS/VETS LIST,Aqueduct Racetrack (NYRA),"Inner Track, Finish of Race",Racing,Thoroughbred,Clear 50 to 55 : degrees F,Siggi the Alien,GARY P. GULLO,RAMON A. DOMINGUEZ,Ziggy the Alien-Tr. Steve Asmussen-pulled up-ambulance off-old chip injury R knee-time off-to be reevaluated for racing,Steward's List
2013,5/3/13,STEWARDS/VETS LIST,Belmont Park (NYRA),belmont Park,Racing,Thoroughbred,60* Clear,Dissension,GARY P. GULLO,LUIS SAEZ,Dissension-Tr. Gary Gullo-eased thru stretch-no injuries reported-must requalify,Lameness
2013,1/12/13,STEWARDS/VETS LIST,Aqueduct Racetrack (NYRA),"Inner Track, Paddock",Racing,Thoroughbred,Cloudy 40 to 45 : degrees F,Wishingonastar,EDWARD R. BARKER,CHRISTOPHER P. DECARLO,Wishingonastar-Tr. Edward Barker-taken from paddock following race-LF leg lameness-must requalify,Lameness
2012,2/3/12,STEWARDS/VETS LIST,Aqueduct Racetrack (NYRA),"Aqueduct Turf, Finish of Race",Racing,Thoroughbred,Clear 40 to 45 : degrees F,Dubai Gold,EDWARD R. BARKER,RAMON A. DOMINGUEZ,Dubai Gold -Tr. Chris Englehart-pulled up-ambulanced off-no injuries reported-back in training,Steward's List
2011,9/3/11,STEWARDS/VETS LIST,Saratoga Racecourse (NYRA),1/4 pole,Racing,Thoroughbred,84* Partly cloudy,Find the Stash,JOHN P. CAMPO JR,JESUS L. CASTANON,Find the Stash-Tr. John Campo Jr.-ambulanced off-lameness L knee-given time off,Steward's List
2013,6/21/13,STEWARDS/VETS LIST,Belmont Park (NYRA),1/8 pole,Racing,Thoroughbred, ,Youngwildandfree,GARY C. CONTESSA, ,Youngwildandfree-Tr. Gary Contessa -pulled up-walked off track - Jockey fell off not hurt, 
2011,12/1/11,STEWARDS/VETS LIST,Aqueduct Racetrack (NYRA),"Inner Track, 1/4 Pole",Racing,Thoroughbred,Clear 45 to 50 : degrees F,House of Leaves,GARY C. CONTESSA, ,House of Leaves-Tr. Gary Contessa-pulled up-ambulanced off-no problems found-retured to racing,Steward's List
2012,9/12/12,STEWARDS/VETS LIST,Belmont Park (NYRA),"Widener Turf, Finish of Race",Racing,Thoroughbred,Clear 75 to 80 : degrees F,She Gets It,GARY C. CONTESSA,JOSE (CARLOS) C. MONTALVO,She Gets It-Tr. Gary Contessa-pulled up-ambulanced off-no injury reported-still training,Equine Injury
2013,5/11/13,STEWARDS/VETS LIST,Belmont Park (NYRA), ,Racing,Thoroughbred, ,Hewitts,GARY C. CONTESSA,IRAD ORTIZ JR,Hewitts - TOR G. Contessa - Pulled up - bled - vanned off - animal sound otherwise,Steward's List
2012,12/28/12,STEWARDS/VETS LIST,Aqueduct Racetrack (NYRA),"Inner Track, Finish of Race",Racing,Thoroughbred,Clear 30 to 40 : degrees F,Burning Flame,GARY C. CONTESSA,WILMER GARCIA,Burning Flame-Tr. Gary Contessa -pulled up-walked off-twisted shoe-no injuries found-must requalify, 
2012,9/19/12,STEWARDS/VETS LIST,Belmont Park (NYRA),3/16 Pole,Racing,Thoroughbred,Partly Cloudy,Goodtolook,GARY C. CONTESSA,ANNA (ROSIE) R. NAPRAVNIK,Goodtolook-Tr. Gary Contessa-pulled up-ambulanced off-no injury reported-must requalify,Steward's List
2012,12/9/12,STEWARDS/VETS LIST,Aqueduct Racetrack (NYRA),"Inner Track, 3/8 Pole",Racing,Thoroughbred,Cloudy 50 to 55 : degrees F,Chase On Home,MICHAEL J. SHEVY,JACQUELINE A. DAVIS,Chase On Home-Tr. Michael Shevy-pulled up-ambulanced off-bowed LF tendon-retired,Equine Injury
2011,9/24/11,STEWARDS/VETS LIST,Belmont Park (NYRA),3/8 pole,Racing,Thoroughbred,73* Mostly cloudy,Chase On Home,MICHAEL J. SHEVY,MAYLAN L. STUDART,Chase On Home-Tr. Michael Shevy-pulled up-ambulanced off - no injuries reported,Steward's List
2012,3/25/12,STEWARDS/VETS LIST,Aqueduct Racetrack (NYRA),"Main Track, 3/8 Pole",Racing,Thoroughbred,Cloudy 45 to 50 : degrees F,There Goes Molly,PATRICK L. REYNOLDS,ARIEL E. SMITH,There Goes Molly-Tr. Patrick Reynolds-pulled up-ambulance off-must requalify,Steward's List
2012,5/27/12,STEWARDS/VETS LIST,Belmont Park (NYRA),"Main Track, 3/8 Pole",Racing,Thoroughbred,Partly Cloudy 70 to 75 : degrees F,Secret Getaway,ROBERT S. YOUNG,JOSE L. ORTIZ,Secret Getaway-Tr. Robert Young-lost contact with field leaving gate-pulled up-ambulanced off-xrays negative-will watch for unusual signs,Steward's List
2012,12/6/12,STEWARDS/VETS LIST,Aqueduct Racetrack (NYRA),"Main Track, Post Parade",Racing,Thoroughbred,Clear 30 to 40 : degrees F,The Big Deluxe,GARY J. SCIACCA,JOSE L. ORTIZ,The Big Deluxe-Tr. Gary Sciacca-unseated rider & broke free running into rail-scratched-no injuries reported,Equine Injury
2012,7/13/12,STEWARDS/VETS LIST,Belmont Park (NYRA),"Widener Turf, Finish of Race",Racing,Thoroughbred,Cloudy 80 to 85 : degrees F,Riptide,GARY J. SCIACCA,MAYLAN L. STUDART,Riptide-Tr. Gary Sciacca-pulled up-ambulanced off-inflammed LF suspensories-rested then re-evaluated,Equine Injury
2012,1/11/12,STEWARDS/VETS LIST,Aqueduct Racetrack (NYRA),"Inner Track, 5/8 Pole",Racing,Thoroughbred,Cloudy 40 to 45 : degrees F,Coljak,GARY J. SCIACCA,CHARLES C. LOPEZ,Coljac-Tr. Gary Sciacca-chipped sesamoid - Bereford-Tr. William Turner-bled-Coljak-retired-Baresford must requalify,Steward's List
2012,3/24/12,STEWARDS/VETS LIST,Aqueduct Racetrack (NYRA),"Main Track, Finish of Race",Racing,Thoroughbred,Cloudy 50 to 55 : degrees F,Ferocious Won,GARY J. SCIACCA,MICHAEL J. LUZZI,Ferocious Won-Tr. Gary Sciacca-pulled up-ambulanced off-no injuries reported-must requalify,Steward's List
2012,10/24/12,STEWARDS/VETS LIST,Belmont Park (NYRA),"Inner Turf, 1/8 Pole",Racing,Thoroughbred,Cloudy 55 to 60 : degrees F,Alwaysinmycircle,DOMINICK A. SCHETTINO,JUNIOR R. ALVARADO,Alwaysinmycircle-Tr. Dominick Schettino-pulled up-walk off track-no injuries reported-must requalify,Steward's List
2013,3/14/13,STEWARDS/VETS LIST,Aqueduct Racetrack (NYRA),Finish,Racing,Thoroughbred, ,Motion Lounge,DOMINICK A. SCHETTINO,MICHAEL J. LUZZI,Motion Lounge-Tr. Dominick Schettino-eased at wire-bled-must requalify, 
2012,12/7/12,STEWARDS/VETS LIST,Aqueduct Racetrack (NYRA),"Main Track, Finish of Race",Racing,Thoroughbred,Cloudy 30 to 40 : degrees F,Milkyyourway,DOMINICK A. SCHETTINO,RAJIV C. MARAGH,Milkyyourway-Tr. Dominick Schettino-pulled up-ambulanced off-no injuries reported-must requalify,Equine Injury
2012,6/30/12,STEWARDS/VETS LIST,Belmont Park (NYRA),"Widener Turf, 1/16 Pole",Racing,Thoroughbred,Hazy above 90 : degrees F,Tommy Karakorum,LESLIE W. HINDS,JOSE (CARLOS) C. MONTALVO,Tommy Karakorum-Tr. Leslie Hinds-pulled up-ambulanced off-hit itself behind-rubs both hind ankles-healing,Steward's List
2012,11/3/12,STEWARDS/VETS LIST,Aqueduct Racetrack (NYRA),"Main Track, 1/8 Pole",Racing,Thoroughbred,Partly Cloudy 50 to 55 : degrees F,Jealous,LESLIE W. HINDS,CHARLES C. LOPEZ,Jealous-Tr. Leslie Hinds-pulled up-walked off track-strained stifle & bruised hip-must requalify,Steward's List
2012,9/22/12,STEWARDS/VETS LIST,Belmont Park (NYRA),Main Track,Racing,Thoroughbred,Cloudy 65 to 70 : degrees F,Inquest,CARLOS F. MARTIN,MICHAEL J. LUZZI,Inquest-Tr. Carlos Martin-eased up-walked off track-no injury found-must re-qualify,Steward's List
2012,7/15/12,STEWARDS/VETS LIST,Belmont Park (NYRA),Before finish,Racing,Thoroughbred,Hazy 85-90 degrees,Style Watch,CARLOS F. MARTIN,JOSE (CARLOS) C. MONTALVO,Style Watch - Tr. Carlos Martin - pulled up - ambulanced off - uninjured- received dirt in the face - stopped running-must requalify,Steward's List
2012,5/27/12,STEWARDS/VETS LIST,Belmont Park (NYRA),"Main Track, 1/16 pole",Racing,Thoroughbred,Partly Cloudy 70 to 75 : degrees F,Style Watch,CARLOS F. MARTIN,ABEL LEZCANO,Style Watch-Tr. Carlos Martin-pulled up-ambulanced off-no injuries reported-must requalify,Steward's List
2011,11/27/11,STEWARDS/VETS LIST,Aqueduct Racetrack (NYRA),"Aqueduct Turf, 1/4 Pole",Racing,Thoroughbred,Clear 55 to 60 : degrees F,Gumption,BRUCE N. LEVINE,DAVID COHEN,Gumption-Tr. Bruce Levine-pulled up-ambulanced off-nothing found-resumed training,Steward's List
2012,3/8/12,STEWARDS/VETS LIST,Aqueduct Racetrack (NYRA),"Inner Track, Finish of Race",Racing,Thoroughbred,Clear 55 to 60 : degrees F,Titus Catienus,BRUCE N. LEVINE,IRAD ORTIZ JR,Titus Catienus-Tr. Bruce Levine-pulled up-ambulanced off-bled-must requalify,Steward's List
2012,1/7/12,STEWARDS/VETS LIST,Aqueduct Racetrack (NYRA),"Inner Track, Finish of Race",Racing,Thoroughbred,Sunny 55 to 60 : degrees F,Sewan Indian,BRUCE N. LEVINE,IRAD ORTIZ JR,Sewan Indian-Tr.Bruce Levine-ambulanced off-horse bled,Steward's List
2012,8/15/12,STEWARDS/VETS LIST,Saratoga Racecourse (NYRA),"Inner Turf, Finish of Race",Racing,Thoroughbred,Mostly Cloudy 80 to 85 : degrees F,Dual Mandate,TERESA M. POMPAY,RAJIV C. MARAGH,Dual Mandate-Tr. Terry Pompay-pulled up-ambulanced off-horse bled-convalescing,Steward's List
2011,9/20/11,STEWARDS/VETS LIST,Finger Lakes Gaming & Racetrack,First turn,Racing,Thoroughbred, ,SARATOGA WARRIOR,MICHAEL A. LECESSE,LUIS E. PEREZ,Saratoga Warrior-Tr. Michael Lecesse-pulled up-Lame left hind leg-must requalify,Lameness
2012,9/22/12,STEWARDS/VETS LIST,Belmont Park (NYRA),Finish,Racing,Thoroughbred,Cloudy,My Brother Rudy,JOSEPH A. LOSTRITTO,JULISSA LAREDO,My Brother Rudy-Tr. Joseph Lostritto-eased up-walked off track-no injury reported-must re-qualify,Steward's List
2012,4/5/12,STEWARDS/VETS LIST,Aqueduct Racetrack (NYRA),"Aqueduct Turf, Starting Gate",Racing,Thoroughbred,Clear 60 to 65 : degrees F,Star Lillie,DAVID G. DONK,IRAD ORTIZ JR,Star Lillie-Tr. David Donk-reared and hit hind end-scratched-walked off track-horse ok & still training,Steward's List
2012,8/17/12,STEWARDS/VETS LIST,Saratoga Racecourse (NYRA),After Finish,Racing,Thoroughbred, ,Stack the Storm,JONATHAN E. SHEPPARD,ANNA (ROSIE) R. NAPRAVNIK,Stack the Storm-Tr. Jonathan Sheppard-pulled up-ambulanced off-no injuries reported-resumed training,Steward's List
2012,8/23/12,STEWARDS/VETS LIST,Saratoga Racecourse (NYRA),"Inner Turf, 10TH FENCE",Racing,Thoroughbred,Clear 80 to 85 : degrees F,Divine Fortune,JONATHAN E. SHEPPARD,BRIAN CROWLEY,Divine Fortune-Tr. J. Sheppard- fell unseated rider/Left Unsaid-Tr. T. Voss-fell over fallen horse-no injuries to horses or riders reported,Steward's List
2012,12/27/12,STEWARDS/VETS LIST,Aqueduct Racetrack (NYRA),"Inner Track, First Turn",Racing,Thoroughbred,Mostly Cloudy 30 to 40 : degrees F,The Kenosha Kid,CHRISTOPHER J. ENGLEHART,PABLO MORALES,The Kenosha Kid-Tr. Christopher Englehart-bolted to outside-pulled up-walked off-no injuries reported,Steward's List
2012,10/21/12,STEWARDS/VETS LIST,Belmont Park (NYRA),"Main Track, Finish of Race",Racing,Thoroughbred,,Powhatan County,CHRISTOPHER J. ENGLEHART,RAJIV C. MARAGH,Powhatan County-TR Christopher Englehart-ambulanced off-no injuries reported,Steward's List
2012,8/16/12,STEWARDS/VETS LIST,Finger Lakes Gaming & Racetrack,"Main Track, Gate-1st Turn",Racing,Thoroughbred,Sunny 75 to 80 : degrees F,Life's Precious,CHRISTOPHER J. ENGLEHART,JOHN R. DAVILA,Life's Precious-Tr. Chris Englehart-pulled up-walked off track-possibly pulled muscle L hip-must requalify,Steward's List
2012,3/24/12,STEWARDS/VETS LIST,Aqueduct Racetrack (NYRA),"Main Track, Finish of Race",Racing,Thoroughbred,Sunny 55 to 60 : degrees F,Wetzel,CHRISTOPHER J. ENGLEHART,CORNELIO VELASQUEZ,Wetzel-Tr. Neal Terracciano-pulled up-ambulanced off-old L knee fx-horse walking,Steward's List
2011,10/19/11,STEWARDS/VETS LIST,Belmont Park (NYRA),1/4 Pole,Racing,Thoroughbred,Rain 50-60*,Girl of Pangaea,SCOTT J. VOLK,JOSE LEZCANO,Girl of Pangaea-Tr. Scott Volk-ambulanced off-did not like muddy track-no injuries reported- retired, 
2012,6/30/12,STEWARDS/VETS LIST,Belmont Park (NYRA),"Inner Turf, Finish of Race",Racing,Thoroughbred,Hazy above 90 : degrees F,Stormy Success,JOHN T. TOSCANO JR,JOSE (CARLOS) C. MONTALVO,Stormy Success-Tr. John Toscano-pulled up-ambulanced off-grabbed L quarter-back in training,Steward's List
2011,9/5/11,STEWARDS/VETS LIST,Saratoga Racecourse (NYRA),3/8 pole,Racing,Thoroughbred,68* cloudy,J C's Pride,ROBERT A. BARBARA,JOSE LEZCANO,J C's Pride-Tr. Robert Barbara-bumped another horse-pulled up-ambulanced off-bruise R ankle,Steward's List
2013,1/13/13,STEWARDS/VETS LIST,Aqueduct Racetrack (NYRA),"Inner Track, AT THE START ",Racing,Thoroughbred,Mostly Cloudy 55 to 60 : degrees F,MAC'S INK,ROBERT A. BARBARA,PABLO MORALES,Mac's Ink-Tr. Robert Barbara-stumbled at start- grabbed left quarter- unseating rider,Steward's List
2012,5/9/12,STEWARDS/VETS LIST,Finger Lakes Gaming & Racetrack,"Main Track, Finish of Race",Racing,Thoroughbred,,Touchdowntony,DANIEL H. CONWAY JR,JOEL CRUZ,Touchdowntony-Tr. Daniel Conway-pulled up-ambulanced off-LR lameness,Steward's List
2012,12/13/12,STEWARDS/VETS LIST,Aqueduct Racetrack (NYRA),"Inner Track, 1/4 Pole",Racing,Thoroughbred,Partly Cloudy 30 to 40 : degrees F,Shea Goodbye,KARL M. GRUSMARK,JACQUELINE A. DAVIS,Shea Goodbye-Tr. Karl Grusmark-pulled up-ambulanced off-apparent locked stifle but fine-must requalify,Equine Injury
2011,10/3/11,STEWARDS/VETS LIST,Finger Lakes Gaming & Racetrack,3/8 Pole,Racing,Thoroughbred, ,ONE FORTY,JONATHAN B. BUCKLEY,RODOLFO IGNACIO,One Forty-Tr. Jonathan Buckley-pulled up-ambulanced off-lame L hind-referred to vet for re-examination,Steward's List
2013,1/13/13,STEWARDS/VETS LIST,Aqueduct Racetrack (NYRA),"Inner Track, Finish of Race",Racing,Thoroughbred,Mostly Cloudy 50 to 55 : degrees F,Opus A,RICHARD A. VIOLETTE JR,RAMON A. DOMINGUEZ,Opus A-Tr. Richard Violette-vanned off track- re injured RF sesamoid FX- retired,Steward's List
