Year,Incident Date,Incident Type,Track,Inv Location,Racing Type Description,Division,Weather Conditions,Horse,Trainer,Jockey Driver,Incident Description,Death or Injury
2010,5/22/10,RACING INJURY,Belmont Park (NYRA),1/4 pole,Racing,Thoroughbred,65* cloudy,Blow Up,JOHN T. TOSCANO JR, ,Horse Blow Up was pulled up at the 1/4 pole and walk off under his own power, 
2010,5/30/10,RACING INJURY,Belmont Park (NYRA),1/8 Pole,Racing,Thoroughbred, ,Moonlight Dreamer,PETER R. WALDER,RAJIV C. MARAGH,Moonlight Dreamer-Tr. Peter Walder-pulled up-LF soft tissue injury-done racing-broodmare,Injury
2010,4/15/10,RACING INJURY,Aqueduct Racetrack (NYRA),After the finish of the 6th race,Racing,Thoroughbred,70* Clear,My Golden Knight,BRUCE R. BROWN, ,My Golden Knight-Tr. Bruce Brown-fx LF cannon bone-to Ruffian Clinic for surgery to repair-retire after recouping,Injury
2010,6/3/10,RACING INJURY,Belmont Park (NYRA),1/16 Pole,Racing,Thoroughbred,82* Cloudy,Mom Proof,RAINDRANAUTH PERSAUD,ANGEL E. SERPA,Mom Proof-Tr. R. Persaud-pulled up-ambulanced off-horse ok-to farm for time off,Steward's List
2010,4/11/10,RACING INJURY,Aqueduct Racetrack (NYRA),1/4 Pole,Racing,Thoroughbred,65* Sunny,Pop Panebianco,OSVALDO ROJAS, ,Pop Panebianco-Tr. Osvaldo Rojas-pulled up-ambulanced off-LF suspensory damage-horse retired,Injury
2010,6/12/10,RACING INJURY,Belmont Park (NYRA),After the Race,Racing,Thoroughbred,Clear 68*,Leonidas the Great,SCOTT D. EVERETT,ALAN GARCIA,Leonidas the Great- Tr. Scott Everett-pulled up-vanned off-fx LF cannon bone-to KY for surgery,Injury
2010,5/16/10,RACING INJURY,Belmont Park (NYRA),After race,Racing,Thoroughbred,Sunny,Pow Wow,ANTHONY W. DUTROW,RAMON A. DOMINGUEZ,Pow Wow-Tr. Anthony Dutrow-fx foot-surgery-to farm to recover,Injury
2010,1/8/10,RACING INJURY,Aqueduct Racetrack (NYRA),After finishing race.,Racing,Thoroughbred,Cloudy,El Tamberito,ANTHONY W. DUTROW, ,El Tamberito-Tr. Anthony Dutrow-ambulanced off-fx LF leg-surgery & retire to farm,Injury
2010,5/5/10,RACING INJURY,Belmont Park (NYRA), ,Racing,Thoroughbred,75* Clear,No More Stress,RICHARD E. DUTROW JR, ,No More Stress-Tr. Richard Dutrow-ambulanced off track-no apparent injury-given time off,Lameness
2010,8/22/10,RACING INJURY,Saratoga Racecourse (NYRA),3/8 Pole,Racing,Thoroughbred,Raine 69*,Bricklayer,FRANK A. ALEXANDER,CHANNING R. HILL,Bricklayer-Tr. Frank Alexander-ambulanced off-Fx LF cannon bone-surgery-no longer racing,Injury
2010,10/11/10,RACING INJURY,Belmont Park (NYRA),After finish,Racing,Thoroughbred,65* Clear,Voodoouthinkur,EUGENE A. REIFF,JORGE F. CHAVEZ,Voodoouthinkur-Tr. Eugene Reiff-pulled up-ambulanced off-LF suspensory lameness-to be retired,Injury
2011,7/2/11,RACING INJURY,Belmont Park (NYRA),After finish,Racing,Thoroughbred,85* Clear,Karakorum On Black,JEFFREY K. ODINTZ,MAYLAN L. STUDART,Karakorum Black-Tr. Jeff Odintz-ambulanced off-fx R sesamoid-retired,Injury
2011,5/29/11,RACING INJURY,Belmont Park (NYRA),After the finish,Racing,Thoroughbred,85* Cloudy,Karakorum Jete,JEFFREY K. ODINTZ,MAYLAN L. STUDART,Karakorum Jete-Tr. Jeff Odintz-pulled up-ambulanced off-bled-back training,Injury
2011,6/8/11,RACING INJURY,Belmont Park (NYRA),After finish,Racing,Thoroughbred,90* Clear,Yo Karakorum,JEFFREY K. ODINTZ,JOSE L. ESPINOZA,Yo karakorum-Tr. Jeff Odintz-ambulanced off-heat in LF knee-couple days off,Lameness
2011,1/8/11,RACING INJURY,Aqueduct Racetrack (NYRA),After finish,Racing,Thoroughbred,34* Cloudy,Financial Storm,CHARLTON A. BAKER,CHANNING R. HILL,Financial Storm-Tr. Charlton Baker-vanned off-RF suspensory issue-to farm for rest,Injury
2011,7/14/11,RACING INJURY,Belmont Park (NYRA),After the finish,Racing,Thoroughbred,80* Clear,My Cousin Eddie,NEAL J. TERRACCIANO,IRAD ORTIZ JR,My Cousin Eddie-Tr. Neal Terraciano-ambulanced off -LF bowed tendon-given time off, 
2010,9/24/10,RACING INJURY,Belmont Park (NYRA),After finish,Racing,Thoroughbred,85* Clear,Coach Homer,JOHN C. KIMMEL,ALEX O. SOLIS,Coach Homer-Tr. John Kimmel-ambulanced off-LF Bowed tendon-horse retired,Lameness
2011,1/23/11,RACING INJURY,Aqueduct Racetrack (NYRA),After finish,Racing,Thoroughbred,19* Clear,Julie's Ina Frenzy,KEITH L. O'BRIEN,LUIS . RIVERA JR,Julie's Ina Frenzy-Tr. Keith O'Brien-pulled up-ambulanced off-sore RF knee,Lameness
2010,12/9/10,RACING INJURY,Aqueduct Racetrack (NYRA),Going into First Turn,Racing,Thoroughbred,Clear 32*,Drink At Last Call,GARY C. CONTESSA,JAIME RODRIGUEZ,Drink At Last Call-Tr. Gary Contessa-bumped unseating rider-ambulanced off-LF ankle laceration-surgery-horse doing well,Injury
2011,8/26/11,RACING INJURY,Saratoga Racecourse (NYRA),After Finish,Racing,Thoroughbred,70* Clear,HOT DANGER,GARY C. CONTESSA,JAVIER J. CASTELLANO,Hot Danger -Tr. Gary Contessa-ambulanced off-chip lower R cannon bone-sent to surgery,Injury
2011,8/1/11,RACING INJURY,Saratoga Racecourse (NYRA),Finish of Race,Racing,Thoroughbred,Sunny 80-85*,High Flying Adore,GARY C. CONTESSA,JOSE L. ESPINOZA,High Flying Adore-Tr. Gary Contessa-ambulanced off-R Knee fx-retired,Injury
2010,10/24/10,RACING INJURY,Belmont Park (NYRA),After finish of the race,Racing,Thoroughbred,62* Cloudy,Being Queen,MICHAEL J. SHEVY,ALBIN JIMENEZ,Being Queen-Tr. Michael J. Shevy-ambulanced off-Fx RF knee,Injury
2010,8/28/10,RACING INJURY,Saratoga Racecourse (NYRA),After the Finish,Racing,Thoroughbred,Clear 80*,Angel Wave,DOMINICK A. SCHETTINO,JOSE L. ESPINOZA,Angel Wave-Tr. Dominick Schettino-pulled up-ambulanced off-pulled LH plantar ligament,Injury
2011,1/16/11,RACING INJURY,Aqueduct Racetrack (NYRA),Starting gate,Racing,Thoroughbred,Clear  30*,Linear Motion,CARLOS F. MARTIN,CHANNING R. HILL,Linear Motion-Tr. Carlos Martin-unseated rider when he kicked Heart of Derby-Tr. Karl Grusmark-both scratched-no injuries reported,Accident
2010,8/5/10,RACING INJURY,Saratoga Racecourse (NYRA),After finish of race,Racing,Thoroughbred,Cloudy 86*,Legal Consent,CARLOS F. MARTIN,JOSE LEZCANO,Legal Consent-Tr. Carlos Martin-ambulanced off-pulled LF suspensory-retired,Injury
2010,11/12/10,RACING INJURY,Aqueduct Racetrack (NYRA),After the finish of the race,Racing,Thoroughbred,Clear 56*,High Prize,BRUCE N. LEVINE,CORNELIO VELASQUEZ,High Prize-Tr.Bruce Levine-ambulanced off-LF bowed tendon-possible retirement,Injury
2011,7/7/11,RACING INJURY,Belmont Park (NYRA),3/8 pole,Racing,Thoroughbred,88* Partly cloudy,Cellist,BRUCE N. LEVINE,DAVID COHEN,Cellist-Tr. Bruce Levine-pulled up-ambulanced off-stifle locked up-no injury reported-stall rest, 
2011,7/2/11,RACING INJURY,Belmont Park (NYRA),After finish,Racing,Thoroughbred,75-80 Clear,Run to Grand Ave,BRUCE N. LEVINE,JAIME RODRIGUEZ,Run to Grand Ave-Tr. Bruce Levine-ambulanced off-jammed ankle-trained without problem thereafter,Injury
2011,6/29/11,RACING INJURY,Belmont Park (NYRA),After finish,Racing,Thoroughbred,85* Clear,Lake and Ludlow,BRUCE N. LEVINE,JAIME RODRIGUEZ,Lake and Ludlow-Tr. Bruce N. Levine-ambulanced off-sustained RF sesamoid fx-to Florida for surgery,Injury
2010,12/10/10,RACING INJURY,Aqueduct Racetrack (NYRA),After finish,Racing,Thoroughbred,33* Cloudy,B Z Warrior,BRUCE N. LEVINE,JUNIOR R. ALVARADO,B Z Warrior-Tr. Bruce Levine ambulanced off-ambulanced off-LF pulled suspensory-horse ok,Injury
2010,10/31/10,RACING INJURY,Belmont Park (NYRA),After the finish,Racing,Thoroughbred,56* Clear,Nostre Aetate,ANGEL A. PENNA JR,EDGAR S. PRADO,Nostre Aetate-Tr. Angel Penna  Jr.-ambulanced off-Fx RF sesamoid-retired,Injury
2011,7/29/11,RACING INJURY,Finger Lakes Gaming & Racetrack,3/8 Pole,Racing,Thoroughbred, ,MAID TO WIN,CHRISTOPHER J. ENGLEHART,JOHN R. DAVILA,Maid to Win-Tr. Christopher Englehart-pulled up-vanned off-heat in front feet-LH stiffness-possible stifle issues,Injury
2011,7/4/11,RACING INJURY,Finger Lakes Gaming & Racetrack,3/8 Pole,Racing,Thoroughbred, ,First Flute,CHRISTOPHER J. ENGLEHART,JOHN R. DAVILA, First Flute-Tr. Chris Englehart-pulled up-ambulanced of-sustained ruptured RF superficial digital flexor tendon-retired,Injury
2011,4/30/11,RACING INJURY,Belmont Park (NYRA),After the Race,Racing,Thoroughbred, ,Smokin Conrad,DAVID H. ADEL,JACQUELINE A. DAVIS,Smokin Conrad-Tr. David Adel-pulled up-vanned off-fx RF Knee- retired,Injury
2010,8/30/10,RACING INJURY,Saratoga Racecourse (NYRA),Eased at 1/8 pole,Racing,Thoroughbred,Clear 88*,Malibu Moonshine,JOHN T. TOSCANO JR,CHANNING R. HILL,Malibu Moonshine-Tr. John Toscano  Jr-ambulanced off-RF tendon-Trainer said horse will be retired,Lameness
2011,8/16/11,RACING INJURY,Finger Lakes Gaming & Racetrack,3/8 pole,Racing,Thoroughbred, ,INSIGHTFUL,MICHAEL(ANTHONY) A. FERRARO,JOHN A. GRABOWSKI,Insightful-Tr. Michael A. Farraro-pulled up-body sore-horse retired,Injury
2010,9/1/10,RACING INJURY,Saratoga Racecourse (NYRA),After the Finish,Racing,Thoroughbred,Clear 92*,Arr Pirates Booty,BRUCE R. BROWN,JAVIER J. CASTELLANO,Arr Pirates Booty-Tr. Bruce Brown-ambulanced off-LF suspensory-Trainer said horse will be retired,Injury
2011,5/4/11,RACING INJURY,Belmont Park (NYRA),After finish,Racing,Thoroughbred,60* Showers,Won Great Classic,BRUCE R. BROWN,DAVID COHEN,Won Great Classic-Tr. Adel  David-ambulanced off-lame RF foot-loose shoe-time off & treatment for sore foot,Injury
2010,11/7/10,RACING INJURY,Aqueduct Racetrack (NYRA),After the Finish,Racing,Thoroughbred,Clear 52*,Aly's Wheat,SANDINO R. HERNANDEZ JR,JOSE E. BERMUDEZ,Aly's Wheat-Tr. Sandy Hernandez  Jr.-pulled up-ambulanced off-RF tendon injury-retired,Injury
2010,8/1/10,RACING INJURY,Saratoga Racecourse (NYRA),After finish of race.,Racing,Thoroughbred,Sunny,Public Speaker,KENNETH G. MC PEEK,ROBBY J. ALBARADO,Public Speaker-Tr. Kenneth McPeek-ambulanced off-LF suspensories-being retired,Injury
2010,8/28/10,RACING INJURY,Saratoga Racecourse (NYRA),After the finish,Racing,Thoroughbred, ,More Than Willing,KENNETH G. MC PEEK,JULIEN R. LEPAROUX,More Than Willing-Tr. Kenneth McPeek-ambulanced off-grabbed quarter-racing in KY,Injury
2011,6/19/11,RACING INJURY,Belmont Park (NYRA),After the finish,Racing,Thoroughbred,85* partly cloudy,Diannedoesthebooks,STEVEN M. ASMUSSEN,RAMON A. DOMINGUEZ,Diannedoesthebooks-Tr. Steven Asmussen-pulled up-ambulanced off-fx R Knee-currently at farm,Injury
2010,9/19/10,RACING INJURY,Belmont Park (NYRA),After finish,Racing,Thoroughbred,70* Clear,Toy Indian,RODOLFO (RUDY) RODRIGUEZ,RAMON A. DOMINGUEZ,Toy Indian-Tr. Rodolfo Rodriguez-ambulanced off-chips in knee-given time off,Lameness
2011,6/17/11,RACING INJURY,Belmont Park (NYRA),after the finish,Racing,Thoroughbred,72* partly cloudy,Half Metal Jaket,RODOLFO (RUDY) RODRIGUEZ,JOSE LEZCANO,Half Metal Jaket-Tr. Rudy Rodriguez-ambulanced off-LF bowed tendon-at farm for time off,Injury
2011,2/9/11,RACING INJURY,Aqueduct Racetrack (NYRA),After the finish,Racing,Thoroughbred,34* Cloudy,Nina's Spirit,JAMES W. FERRARO,ABEL LEZCANO,Nina's Spirit-Tr. James W. Ferraro-ambulanced off-sore muscle R side-to vet for treatment,Injury
2011,7/30/11,RACING INJURY,Saratoga Racecourse (NYRA),after finish,Racing,Thoroughbred, ,Giant Surprise,TODD A. PLETCHER,JOHN R. VELAZQUEZ,Giant Surprise-Tr. Todd Pletcher-ambulanced off-fx LF condular,Injury
2011,3/27/11,RACING INJURY,Aqueduct Racetrack (NYRA),Start,Racing,Thoroughbred,Clear 35*,Golden Galleon,TODD A. PLETCHER,DAVID COHEN,Golden Galleon-Tr.-Todd Pletcher-stumbled-pulled up-ambulanced off-minor scratches-horse back training, 
2011,2/18/11,RACING INJURY,Aqueduct Racetrack (NYRA),1/8 Pole,Racing,Thoroughbred,50* Clear,Thunderwave,TODD A. PLETCHER,RAMON A. DOMINGUEZ,Thunderwave-Tr. Todd Pletcher-pulled up-vanned off-lame RF knee-going to be ok,Lameness
2011,4/7/11,RACING INJURY,Aqueduct Racetrack (NYRA),finish line,Racing,Thoroughbred,45* Cloudy,Stormin Bolt,KIARAN P. MC LAUGHLIN,DAVID COHEN,Stormin Bolt- Tr. Kiaran P. McLaughlin-pulled up-ambulanced off-possible post op throat infection-retired, 
2010,8/11/10,RACING INJURY,Saratoga Racecourse (NYRA),After the Finish,Racing,Thoroughbred,Clear 81* F,Sephardic,MARK A. HENNIG,CORNELIO VELASQUEZ,Sephardic-Tr. Mark A Hennig-ambulanced off-RF tendon bowed-retired,Injury
2011,6/19/11,RACING INJURY,Belmont Park (NYRA),After the finish,Racing,Thoroughbred,85* Partly cloudy,Cognito,HERIBERTO CEDANO,EDGAR S. PRADO,Cognito-Tr. Heriberto Cedano-ambulanced off-LF ankle chip-retired to Florida,Injury
2011,5/22/11,RACING INJURY,Belmont Park (NYRA),Finish,Racing,Thoroughbred,60* Cloudy,Steve's Star,ANTHONY W. DUTROW,CORNELIO VELASQUEZ,Steve's Star-Tr. Anthony Dutrow-ambulanced off-Rf suspensory damage-horse resting,Injury
2011,5/4/11,RACING INJURY,Belmont Park (NYRA),After finish,Racing,Thoroughbred,60* Showers,Cuff Me,ANTHONY W. DUTROW,CORNELIO VELASQUEZ,Cuff Me-Tr.-Anthony Dutrow-slowed-ambulanced off-reinjured RF tendon-retired,Injury
2010,8/19/10,RACING INJURY,Saratoga Racecourse (NYRA),After the finish,Racing,Thoroughbred, ,Witchy Meeting,RICHARD E. DUTROW JR,RAMON A. DOMINGUEZ,Witchy Meeting-Tr. Richard Dutrow  Jr-ambulanced off-retired,Injury
2011,7/3/11,RACING INJURY,Belmont Park (NYRA),6th Hurdle,Racing,Thoroughbred,Sunny to T-Storms 75-80*,Good Request,THOMAS H. VOSS,PADDY YOUNG,Good Request-Tr. Thomas Voss-pulled up-vanned off-sustained LF bowed tendon-at farm,Injury
2011,1/6/11,RACING INJURY,Aqueduct Racetrack (NYRA),After the finish,Racing,Thoroughbred,34* Cloudy,Vaporize,ROBERT A. DONATO,GUARIONEX RIVERA,Vaporize-Tr. Robert A. Donato-ambulanced off-LF bowed tendon-retired,Injury
2011,2/11/11,RACING INJURY,Aqueduct Racetrack (NYRA),5/8 pole,Racing,Thoroughbred,34* Clear,Camie's Magic,LINDA L. RICE,RAMON A. DOMINGUEZ,Camie's Magic-Tr. Linda Rice-pulled up-ambulanced off-lame LH stifle-to farm to recover,Injury
2011,3/12/11,RACING INJURY,Aqueduct Racetrack (NYRA),After the Finish,Racing,Thoroughbred,45* Clear,Scale,LINDA L. RICE,CORNELIO VELASQUEZ,Scale-Tr. Linda Rice-pulled up-ambulanced off-fx chip R knee-farm rest,Injury
2011,7/28/11,RACING INJURY,Saratoga Racecourse (NYRA),Finish,Racing,Thoroughbred,80* Clear,Nutmegcuveeroyle,LINDA L. RICE,CORNELIO VELASQUEZ,Nutmegcuveeroyale-Tr. Linda Rice-ambulanced off-fx LF sesamoid,Injury
2010,9/24/10,RACING INJURY,Belmont Park (NYRA),After finish,Racing,Thoroughbred, ,Silver Horseshoe,BARCLAY TAGG,RAMON A. DOMINGUEZ,Silver Horseshoe-Tr. Barclay Tagg-ambulanced off-LF aggravated old bone chip-horse ok,Injury
2011,1/7/11,RACING INJURY,Aqueduct Racetrack (NYRA),After finish,Racing,Thoroughbred,Snow 30*,Fourth Chapter,JAMES H. ISELIN,RAMON A. DOMINGUEZ,Fourth Chapter-Tr. James Iselin-ambulanced off-RF tendon injury-retired,Injury
2011,8/5/11,RACING INJURY,Saratoga Racecourse (NYRA),1/4 pole,Racing,Thoroughbred,85* Partly Cloudy,Bearpath,IAN WILKES,FREDERIC LENCLUD,Bearpath-Tr. Ian Wilkes-unseated rider-ambulanced off-fx RF shoulder-to Kentucky to retire,Injury
2011,3/10/11,RACING INJURY,Aqueduct Racetrack (NYRA),Start,Racing,Thoroughbred,Cloudy 36*,Talented Princess,DAVID JACOBSON,DAVID COHEN,Talented Princess-Tr. David Jacobson-pulled up-LH leg injury-unseated rider-stall rest-rider treated & released,Injury
2011,7/7/11,RACING INJURY,Belmont Park (NYRA),1/16 pole,Racing,Thoroughbred,88* partly Cloudy,Bon Marie,DAVID JACOBSON,DAVID COHEN,Bon Marie-Tr. David Jacobson-pulled up-ambulanced off-pulled RF tendon-retired, 
2011,8/13/11,RACING INJURY,Saratoga Racecourse (NYRA),After the finish,Racing,Thoroughbred,83* Clear,Rahy's Attorney,IAN BLACK,EMMA-JAYNE WILSON,Rahy's Attorney-Tr. Ian Black-ambulanced off-sustained torn F tendon-retired,Injury
2012,1/13/12,RACING INJURY,Aqueduct Racetrack (NYRA),"Inner Track, Finish of Race",Racing,Thoroughbred,30 to 40 : degrees F,Sheriff Silverstar, ,ALAN GARCIA,Sheriff Silverstar-Tr. Ken McPeek-pulled up-ambulanced off-hairline fx LF shin-stall/farm rest,Equine Injury
2011,10/19/11,RACING INJURY,Belmont Park (NYRA),Belmont R/T,Racing,Thoroughbred,Rain,Flavor Girl,HARRY A. JERKENS,RYAN A. CURATOLO,Flavor Girl-Tr. Harry Jerkens-ambulanced off-fx RF leg-horse retired,Injury
2011,11/4/11,RACING INJURY,Aqueduct Racetrack (NYRA),"Main Track, Finish of Race",Racing,Thoroughbred,Clear 50 to 55 : degrees F,Written in Stone,DOMINIC G. GALLUSCIO,IRAD ORTIZ JR,Written in Stone - Tr. Dominick Galluscio-pulled up-ambulanced off-old RF tendon issue-back training,Equine Injury
2011,12/16/11,RACING INJURY,Aqueduct Racetrack (NYRA),"Inner Track, 3/8 Pole",Racing,Thoroughbred,Sunny 45 to 50 : degrees F,Nykid Time to Jazz,DOODNAUTH SHIVMANGAL,JOSE (CARLOS) C. MONTALVO,Nykid Time to Jazz - Tr. D. Shivmangal - vanned off track - strained old tendon injury - will be retired,Lameness
2011,10/28/11,RACING INJURY,Belmont Park (NYRA),1/4 Pole,Racing,Thoroughbred,Clear 50 to 55 : degrees F,Harry Consolidator,DOODNAUTH SHIVMANGAL,ARIEL E. SMITH,Harry Consolidator-Tr. D. Shivmangal-stumbled-ambulanced off-severe RF quarter grab requiring sutures-healing,Equine Injury
2012,8/6/12,RACING INJURY,Saratoga Racecourse (NYRA),"Main Track, 3/16 Pole",Racing,Thoroughbred,Partly Cloudy 75 to 80 : degrees F,Afleet Bird,NICHOLAS P. ZITO,ANNA (ROSIE) R. NAPRAVNIK,Afleet Bird-Tr. Nick Zito-pulled up-ambulanced off-fx RF leg-to clinic for surgery-prognosis guarded-on farm recovering,Equine Injury
2012,4/12/12,RACING INJURY,Aqueduct Racetrack (NYRA),"Main Track, Finish of Race",Racing,Thoroughbred,Cloudy 50 to 55 : degrees F,Disco Linguine,CHARLTON A. BAKER,JUNIOR R. ALVARADO,Disco Linguine-Tr. Charlton Baker-pulled up-ambulanced off- Fx L Knee- retired,Equine Injury
2012,5/25/12,RACING INJURY,Finger Lakes Gaming & Racetrack,"Main Track, Finish of Race",Racing,Thoroughbred,Partly Cloudy 85 to 90 : degrees F,Delastmanstanding,CHARLTON A. BAKER,DENNIS CARR,Delastmanstanding-Tr. Charlton Baker-heat stroke-received cold water bath and was revived,Injury
2012,4/28/12,RACING INJURY,Belmont Park (NYRA),"Inner Turf, Finish of Race",Racing,Thoroughbred,Cloudy 50 to 55 : degrees F,Outstanding Hope,BRUCE F. ALEXANDER,JOSE L. ORTIZ,Outstanding Hope-Tr. Bruce Alexander-pulled up-ambulanced off-lacerated  ankle and  grabbed a quarter,Equine Injury
2011,11/20/11,RACING INJURY,Aqueduct Racetrack (NYRA),"Main Track, 1/16 pole",Racing,Thoroughbred,Clear 50 to 55 : degrees F,B G Suavecito,DIANE C. BALSAMO,CHARLES C. LOPEZ, BG Suavecito-Tr. Diane Balsamo-ambulanced off-possible fx RF sesamoid-to farm to recoup,Equine Injury
2012,6/9/12,RACING INJURY,Finger Lakes Gaming & Racetrack,"Main Track, 1/8 Pole",Racing,Thoroughbred,Partly Cloudy 75 to 80 : degrees F,River City Rebel,TIMOTHY P. MURPHY,EMANUEL DE DIEGO,River City Rebel - Tr. Timothy Murphy - pulled up - ambulanced off - LF bowed tendon,Equine Injury
2011,11/13/11,RACING INJURY,Aqueduct Racetrack (NYRA),"Main Track, First Turn",Racing,Thoroughbred,Clear 60 to 65 : degrees F,Dancin On the Sand,RALPH D'ALESSANDRO,JUNIOR R. ALVARADO,Dancin on the Sand-Tr. Ralph D'Alessandro-pulled up-ambulanced off-horse tied up-back in training,Equine Injury
2012,6/19/12,RACING INJURY,Finger Lakes Gaming & Racetrack,"Main Track, Finish of Race",Racing,Thoroughbred,Hot above 90 : degrees F,American Trilogy,LUIS A. GUTIERREZ,OMAR CAMEJO,American Trilogy- Tr. Luis Guttierez-suffered heat stroke-cooled with water -jogged off track-fine next day,Equine Injury
2012,6/17/12,RACING INJURY,Belmont Park (NYRA),"Inner Turf, 1/16 pole ",Racing,Thoroughbred,Clear 70 to 75 : degrees F,Strolldownbroadway,HAROLD (JAMES) J. BOND,RAMON A. DOMINGUEZ,Strolldownbroadway - Tr. Harold Bond - pulled up - ambulanced off - LF suspensory issue - under treatment,Equine Injury
2012,8/18/12,RACING INJURY,Saratoga Racecourse (NYRA),"Main Track, Finish of Race",Racing,Thoroughbred,Partly Cloudy 75 to 80 : degrees F,Zo Impressive,THOMAS ALBERTRANI,RAJIV C. MARAGH,Zo Impressive-Tr. Thomas Albertrani-pulled up-ambulanced off-fx RF Condylar-surgery at Rood & Riddle-doing well-convalescing-retired,Equine Injury
2012,4/21/12,RACING INJURY,Aqueduct Racetrack (NYRA),Finish of Race,Racing,Thoroughbred,Cloudy 55 to 60 : degrees F,King Congie,THOMAS ALBERTRANI,RAJIV C. MARAGH,King Congie-Tr. Thomas Albertrani-pulled up-ambulanced off-fx LF sesamoid-retired,Injury
2012,5/17/12,RACING INJURY,Belmont Park (NYRA),"Widener Turf, Finish of Race",Racing,Thoroughbred,Clear 60 to 65 : degrees F,Waywardwillie,WILLIAM BADGETT JR,OMAR HERNANDEZ,Waywardwillie-Tr. William Badgett-pulled up-ambulanced off-upper suspensory activity-will be rested until inflammation subsides,Equine Injury
2012,5/13/12,RACING INJURY,Belmont Park (NYRA),"Inner Turf, Finish of Race",Racing,Thoroughbred,Clear 65 to 70 : degrees F,Mitigation,GARY P. GULLO,IRAD ORTIZ JR,Mitigation-Tr. Gary Gullo-pulled up-ambulanced off- Fx LF Cannon bone-received screws to stabalize fracture-retired,Equine Injury
2011,11/13/11,RACING INJURY,Aqueduct Racetrack (NYRA),"Turf, Finish of Race",Racing,Thoroughbred,Clear 60 to 65 : degrees F,Targhee Pass,HARRY A. JERKENS,CORNELIO VELASQUEZ,Targhee Pass-Tr. Harry Jerkens-pulled up-ambulanced off-R L suspensory issue-sent to farm to recoup,Equine Injury
2012,1/22/12,RACING INJURY,Aqueduct Racetrack (NYRA),"Inner Track, 1/4 Pole",Racing,Thoroughbred,Cloudy 20 to 30 : degrees F,Poppy Day,ROBERT S. YOUNG, ,Poppy Day-Tr. Robert Young-pulled up-ambulanced-LF tendon injury-time off,Equine Injury
2012,7/29/12,RACING INJURY,Saratoga Racecourse (NYRA),"Mellon Turf, Finish of Race",Racing,Thoroughbred,Mostly Cloudy 75 to 80 : degrees F,Tutti Va Bene,GARY J. SCIACCA,MAYLAN L. STUDART,Tutti Va Bene-Tr. Gary Sciacca-pulled up-ambulanced off-injury RF sesamoid-retired,Equine Injury
2012,6/19/12,RACING INJURY,Finger Lakes Gaming & Racetrack,"Main Track, Finish of Race",Racing,Thoroughbred,Hot above 90 : degrees F,Track Magnet,JOHN W. TEBBUTT JR,RODOLFO IGNACIO,Track Magnet- Tr. John Tebbutt-suffered heat stroke-cooled with water-walked off-doing fine,Equine Injury
2012,5/11/12,RACING INJURY,Belmont Park (NYRA),"Main Track, 1/4 Pole",Racing,Thoroughbred,Clear 60 to 65 : degrees F,Crimsons Gold,DOUGLAS G. NUNN,CHARLES C. LOPEZ,Crimson Gold-Tr. Douglas Nunn-pulled up-ambulanced off-re-bowed L tendon-retired,Equine Injury
2012,5/27/12,RACING INJURY,Belmont Park (NYRA),"Inner Turf, Post Parade",Racing,Thoroughbred,Partly Cloudy 70 to 75 : degrees F,Bangzoomtothemoon,DOMINICK A. SCHETTINO,ANNA (ROSIE) R. NAPRAVNIK,Bangzoomtothemoon-Tr. Dominick Schettino-unseated rider & ran loose-tried to jump rail & fell-helped up-fell again-minor scrapes & soreness reported,Equine Injury
2012,3/11/12,RACING INJURY,Aqueduct Racetrack (NYRA),"Inner Track, 1/8 Pole",Racing,Thoroughbred,Sunny 40 to 45 : degrees F,Stormrageous,DOMINICK A. SCHETTINO,RYAN A. CURATOLO,Stormrageous-Tr. Dominick Shettino-pulled up-ambulanced off-bowed L tendon-stall rest-retired to broodmare,Injury
2012,10/6/12,RACING INJURY,Belmont Park (NYRA),After Finish,Racing,Thoroughbred,70-75 degrees-Mostly Cloudy,Superestrella,DOMINICK A. SCHETTINO,RAMON A. DOMINGUEZ,Superestrella-Tr. Dominick Schettino-pulled up-ambulanced off-LF suspensory issue-given time off,Injury
2011,11/5/11,RACING INJURY,Aqueduct Racetrack (NYRA),During Race,Racing,Thoroughbred,,Bourbon Bandit,BRUCE N. LEVINE, ,Bourbon Bandit-Tr. Bruce Levine-fx R carpus-retired to owner's farm (See Case #723.12 also),Injury
2012,11/4/12,RACING INJURY,Aqueduct Racetrack (NYRA),"Main Track, Finish of Race",Racing,Thoroughbred,Mostly Cloudy 50 to 55 : degrees F,Duke of Naples,BRUCE N. LEVINE,WILMER GARCIA,Duke of Naples-Tr. Bruce Levine-pulled up-ambulanced off-suffered bowed tendon RF leg-retired,Equine Injury
2013,6/13/13,RACING INJURY,Finger Lakes Gaming & Racetrack,3/8 pole,Racing,Thoroughbred, ,Oatka Idas Rose,MICHAEL A. LECESSE,PEDRO A. RODRIGUEZ,Oatka Idas Rose-Tr. Michael Lecesse-pulled up-ambulanced off-possible sesamoid problem-retirement recommended,Lameness
2011,12/14/11,RACING INJURY,Aqueduct Racetrack (NYRA),"Inner Track, Finish of Race",Racing,Thoroughbred,Clear 45 to 50 : degrees F,Spina,CHRISTOPHER J. ENGLEHART, ,Spina-Tr. Chris Englehart-claimed by Carlos Martin-ambulanced from paddock-chip fracture-under vet care- to be re-evaluated,Steward's List
2011,6/26/11,RACING INJURY,Belmont Park (NYRA),After the finish,Racing,Thoroughbred,85* Cloudy,Casa Di Vino,CHRISTOPHER J. ENGLEHART, , Casa Di Vino-Tr. Cristopher Englehart-ambulanced off-bowed tendon-retired,Injury
2012,2/22/12,RACING INJURY,Aqueduct Racetrack (NYRA),Finish of Race,Racing,Thoroughbred,Rain 45 to 50 : degrees F,High Stakes Player,CHRISTOPHER J. ENGLEHART,ANNA (ROSIE) R. NAPRAVNIK,High Stakes Player-Tr. Chris Englehart-pulled up-ambulanced off-fx RF coffin bone-retired,Injury
2012,10/2/12,RACING INJURY,Finger Lakes Gaming & Racetrack,"Main Track, 3/8 Pole",Racing,Thoroughbred,Partly Cloudy 60 to 65 : degrees F,Thunder Reigns,KARL M. GRUSMARK,JOEL SONE,Thunder Reigns-Tr. K. Grusmark-pulled up-ambulanced off-vet checked-bowed tendon-retired,Equine Injury
2011,11/14/11,RACING INJURY,Finger Lakes Gaming & Racetrack,"Main Track, First Turn",Racing,Thoroughbred,,Fiddlers Zephyr,JONATHAN B. BUCKLEY,GABRIEL J. SUAREZ,Fiddlers Zephyr-Tr. Jonathan Buckley-lost action behind unseating rider-sustained abrasions RF leg-to farm-no longer racing,Injury
2012,6/30/12,RACING INJURY,Belmont Park (NYRA),"Main Track, 3/8 Pole",Racing,Thoroughbred,Hazy above 90 : degrees F,Monarchic,EOIN G. HARTY,JOSE LEZCANO,Monarchic-Tr. Eoin Harty-pulled up-ambulanced off-fx RF cannon bone-surgery & retired,Equine Injury
2012,8/25/12,RACING INJURY,Saratoga Racecourse (NYRA),"Main Track, Finish of Race",Racing,Thoroughbred,Clear 80 to 85 : degrees F,Street Life,CHAD C. BROWN,JOSE LEZCANO,Street Life-Tr. Chad Brown-pulled up-ambulanced off-sustained a rupture of the distal sesamoiden ligament LF ankle-currently resting-currently resting before reevaluation,Equine Injury
2011,11/5/11,RACING INJURY,Aqueduct Racetrack (NYRA),"Main Track, Finish of Race",Racing,Thoroughbred,Clear 50 to 55 : degrees F,It's the Big Cat,LEAH A. GYARMATI,ARIEL E. SMITH,It's the Big Cat -Tr. Leah Gyarmati-pulled up-ambulanced off-bled-retired,Equine Injury
